[
  {
    "event_id": "evt-1001",
    "ticket": {"ticket_id": 900001, "player_id": 1244, "stake": 25.5, "currency": "EUR"},
    "selections": [
      {"market_id": 510, "selection_id": 2, "odds": 1.82},
      {"market_id": 511, "selection_id": 4, "odds": 2.10}
    ],
    "created_at": "2026-05-21T10:44:12Z"
  },
  {
    "event_id": "evt-1002",
    "ticket": {"ticket_id": 900002, "player_id": 1288, "stake": 13.0, "currency": "USD"},
    "selections": [{"market_id": 520, "selection_id": 1, "odds": 1.45}],
    "created_at": "2026-05-21T10:45:05Z"
  }
]
